{"$schema":"https://json-schema.org/draft/2020-12/schema","$id":"https://gist.local/contracts/registry/v1/taxonomy.schema.json","type":"object","additionalProperties":false,"required":["id","edition","attribution","nodes"],"properties":{"id":{"type":"string"},"edition":{"type":"string"},"attribution":{"type":"string","minLength":1},"nodes":{"type":"array","items":{"type":"object","additionalProperties":false,"required":["id","level","label","apqc_ref"],"properties":{"id":{"type":"string"},"level":{"type":"integer","minimum":1},"label":{"type":"string"},"parent_id":{"type":["string","null"]},"apqc_ref":{"type":"string"}}}}}}
