{"id":"gist-activities","edition":"1","attribution":"APQC Process Classification Framework (PCF) is an open standard developed by APQC, a nonprofit that promotes benchmarking and best practices worldwide. The PCF is intended to facilitate organizational improvement through process management and benchmarking, regardless of industry, size, or geography. To download the full PCF or industry-specific versions of the PCF, as well as associated measures and benchmarking, please visit www.apqc.org/pcf.\n\n©2026 APQC. All rights reserved in the original work; this derivative is subject to the license above. The attribution text above must be served with the taxonomy document at every endpoint that returns taxonomy nodes (machine-attached, not prose-only), and preserved in any downstream copy.","nodes":[{"id":"1.0","level":1,"label":"Develop Vision and Strategy","parent_id":null,"apqc_ref":"10002"},{"id":"1.1","level":2,"label":"Define the business concept and long-term vision","parent_id":"1.0","apqc_ref":"17040"},{"id":"1.1.1","level":3,"label":"Assess the external environment","parent_id":"1.1","apqc_ref":"10017"},{"id":"1.1.2","level":3,"label":"Survey market and determine customer needs and wants","parent_id":"1.1","apqc_ref":"10018"},{"id":"1.1.3","level":3,"label":"Assess the internal environment","parent_id":"1.1","apqc_ref":"10019"},{"id":"1.1.4","level":3,"label":"Establish strategic vision","parent_id":"1.1","apqc_ref":"10020"},{"id":"1.1.5","level":3,"label":"Conduct organization restructuring opportunities","parent_id":"1.1","apqc_ref":"16792"},{"id":"1.2","level":2,"label":"Develop business strategy","parent_id":"1.0","apqc_ref":"10015"},{"id":"1.2.1","level":3,"label":"Develop overall mission statement","parent_id":"1.2","apqc_ref":"10037"},{"id":"1.2.2","level":3,"label":"Define and evaluate strategic options to achieve the mission","parent_id":"1.2","apqc_ref":"10038"},{"id":"1.2.3","level":3,"label":"Set/Develop long-term enterprise strategy","parent_id":"1.2","apqc_ref":"10039"},{"id":"1.2.4","level":3,"label":"Coordinate and align cross-functional and process strategies","parent_id":"1.2","apqc_ref":"10040"},{"id":"1.2.5","level":3,"label":"Create organizational design","parent_id":"1.2","apqc_ref":"10041"},{"id":"1.2.6","level":3,"label":"Develop and set organizational objectives","parent_id":"1.2","apqc_ref":"10042"},{"id":"1.2.7","level":3,"label":"Formulate business unit strategies","parent_id":"1.2","apqc_ref":"10043"},{"id":"1.2.8","level":3,"label":"Develop customer experience strategy","parent_id":"1.2","apqc_ref":"19959"},{"id":"1.2.9","level":3,"label":"Communicate strategies internally and externally","parent_id":"1.2","apqc_ref":"18916"},{"id":"1.3","level":2,"label":"Develop and measure strategic initiatives","parent_id":"1.0","apqc_ref":"10016"},{"id":"1.3.1","level":3,"label":"Develop strategic initiatives","parent_id":"1.3","apqc_ref":"10057"},{"id":"1.3.2","level":3,"label":"Evaluate strategic initiatives","parent_id":"1.3","apqc_ref":"10058"},{"id":"1.3.3","level":3,"label":"Select strategic initiatives","parent_id":"1.3","apqc_ref":"10059"},{"id":"1.3.4","level":3,"label":"Establish high-level measures","parent_id":"1.3","apqc_ref":"10060"},{"id":"1.3.5","level":3,"label":"Execute strategic initiatives","parent_id":"1.3","apqc_ref":"19507"},{"id":"1.3.6","level":3,"label":"Review execution of strategic initiatives","parent_id":"1.3","apqc_ref":"21422"},{"id":"1.3.7","level":3,"label":"Refine strategic initiatives and project plans as needed","parent_id":"1.3","apqc_ref":"21423"},{"id":"1.4","level":2,"label":"Develop and maintain business models","parent_id":"1.0","apqc_ref":"20944"},{"id":"1.4.1","level":3,"label":"Develop business models","parent_id":"1.4","apqc_ref":"20945"},{"id":"1.4.2","level":3,"label":"Maintain business models","parent_id":"1.4","apqc_ref":"20950"},{"id":"1.4.3","level":3,"label":"Establish business model governance","parent_id":"1.4","apqc_ref":"20955"},{"id":"2.0","level":1,"label":"Develop and Manage Products and Services","parent_id":null,"apqc_ref":"10003"},{"id":"2.1","level":2,"label":"Govern and manage product/service development program","parent_id":"2.0","apqc_ref":"19696"},{"id":"2.1.1","level":3,"label":"Manage product and service portfolio","parent_id":"2.1","apqc_ref":"10061"},{"id":"2.1.2","level":3,"label":"Manage product and service life cycle","parent_id":"2.1","apqc_ref":"10067"},{"id":"2.1.3","level":3,"label":"Manage patents, copyrights, and regulatory requirements","parent_id":"2.1","apqc_ref":"19985"},{"id":"2.1.4","level":3,"label":"Manage product and service master data","parent_id":"2.1","apqc_ref":"11740"},{"id":"2.2","level":2,"label":"Generate and define new product/service ideas","parent_id":"2.0","apqc_ref":"19698"},{"id":"2.2.1","level":3,"label":"Perform discovery research","parent_id":"2.2","apqc_ref":"10065"},{"id":"2.2.2","level":3,"label":"Generate new product/service concepts","parent_id":"2.2","apqc_ref":"19669"},{"id":"2.2.3","level":3,"label":"Define product/service development requirements","parent_id":"2.2","apqc_ref":"19990"},{"id":"2.3","level":2,"label":"Develop products and services","parent_id":"2.0","apqc_ref":"10062"},{"id":"2.3.1","level":3,"label":"Design and prototype products and services","parent_id":"2.3","apqc_ref":"19993"},{"id":"2.3.2","level":3,"label":"Test market for new or revised products and services","parent_id":"2.3","apqc_ref":"19996"},{"id":"2.3.3","level":3,"label":"Prepare for production/service delivery","parent_id":"2.3","apqc_ref":"19997"},{"id":"2.3.4","level":3,"label":"Define warranty claims","parent_id":"2.3","apqc_ref":"20089"},{"id":"2.3.5","level":3,"label":"Develop recall strategy","parent_id":"2.3","apqc_ref":"20092"},{"id":"3.0","level":1,"label":"Market and Sell Products and Services","parent_id":null,"apqc_ref":"10004"},{"id":"3.1","level":2,"label":"Understand markets, customers, and capabilities","parent_id":"3.0","apqc_ref":"10101"},{"id":"3.1.1","level":3,"label":"Perform customer and market intelligence analysis","parent_id":"3.1","apqc_ref":"10106"},{"id":"3.1.2","level":3,"label":"Evaluate and prioritize market opportunities","parent_id":"3.1","apqc_ref":"10107"},{"id":"3.2","level":2,"label":"Develop marketing strategy","parent_id":"3.0","apqc_ref":"21615"},{"id":"3.2.1","level":3,"label":"Define offering and customer value proposition","parent_id":"3.2","apqc_ref":"11168"},{"id":"3.2.2","level":3,"label":"Develop and manage brands","parent_id":"3.2","apqc_ref":"11445"},{"id":"3.2.3","level":3,"label":"Define pricing strategy","parent_id":"3.2","apqc_ref":"10123"},{"id":"3.2.4","level":3,"label":"Define and manage channel strategy","parent_id":"3.2","apqc_ref":"20000"},{"id":"3.2.5","level":3,"label":"Analyze and manage channel performance","parent_id":"3.2","apqc_ref":"20006"},{"id":"3.2.6","level":3,"label":"Develop marketing communication strategy","parent_id":"3.2","apqc_ref":"16848"},{"id":"3.2.7","level":3,"label":"Design and manage customer loyalty program","parent_id":"3.2","apqc_ref":"18924"},{"id":"3.3","level":2,"label":"Develop and manage marketing plans","parent_id":"3.0","apqc_ref":"20008"},{"id":"3.3.1","level":3,"label":"Establish goals, objectives, and measures for products/services by channel/segment","parent_id":"3.3","apqc_ref":"10148"},{"id":"3.3.2","level":3,"label":"Establish marketing budgets","parent_id":"3.3","apqc_ref":"10149"},{"id":"3.3.3","level":3,"label":"Develop and manage pricing","parent_id":"3.3","apqc_ref":"20593"},{"id":"3.3.4","level":3,"label":"Develop and manage promotional activities","parent_id":"3.3","apqc_ref":"20010"},{"id":"3.3.5","level":3,"label":"Track customer management measures","parent_id":"3.3","apqc_ref":"10153"},{"id":"3.3.6","level":3,"label":"Analyze and respond to customer insight","parent_id":"3.3","apqc_ref":"16613"},{"id":"3.3.7","level":3,"label":"Develop and manage packaging strategy","parent_id":"3.3","apqc_ref":"10154"},{"id":"3.3.8","level":3,"label":"Develop go-to-market strategy","parent_id":"3.3","apqc_ref":"21425"},{"id":"3.3.9","level":3,"label":"Manage product marketing material","parent_id":"3.3","apqc_ref":"16629"},{"id":"3.4","level":2,"label":"Develop sales strategy","parent_id":"3.0","apqc_ref":"10103"},{"id":"3.4.1","level":3,"label":"Develop sales forecast","parent_id":"3.4","apqc_ref":"10129"},{"id":"3.4.2","level":3,"label":"Develop sales partner/alliance relationships","parent_id":"3.4","apqc_ref":"10130"},{"id":"3.4.3","level":3,"label":"Establish overall sales budgets","parent_id":"3.4","apqc_ref":"10131"},{"id":"3.4.4","level":3,"label":"Establish sales goals and measures","parent_id":"3.4","apqc_ref":"10132"},{"id":"3.4.5","level":3,"label":"Establish customer management measures","parent_id":"3.4","apqc_ref":"10133"},{"id":"3.5","level":2,"label":"Develop and manage sales plans","parent_id":"3.0","apqc_ref":"10105"},{"id":"3.5.1","level":3,"label":"Manage leads/opportunities","parent_id":"3.5","apqc_ref":"10182"},{"id":"3.5.2","level":3,"label":"Manage customers and accounts","parent_id":"3.5","apqc_ref":"10183"},{"id":"3.5.3","level":3,"label":"Develop and manage sales proposals, bids, and quotes","parent_id":"3.5","apqc_ref":"11779"},{"id":"3.5.4","level":3,"label":"Manage sales orders","parent_id":"3.5","apqc_ref":"10185"},{"id":"3.5.5","level":3,"label":"Manage sales partners and alliances","parent_id":"3.5","apqc_ref":"10187"},{"id":"3.5.6","level":3,"label":"Perform sales at physical outlets","parent_id":"3.5","apqc_ref":"21427"},{"id":"3.5.7","level":3,"label":"Perform field sales","parent_id":"3.5","apqc_ref":"21428"},{"id":"3.5.8","level":3,"label":"Perform digital sales","parent_id":"3.5","apqc_ref":"21429"},{"id":"4.0","level":1,"label":"Manage Supply Chain for Physical Products","parent_id":null,"apqc_ref":"20022"},{"id":"4.1","level":2,"label":"Plan for and align supply chain resources","parent_id":"4.0","apqc_ref":"10215"},{"id":"4.1.1","level":3,"label":"Devel